{
  "id": "2695effb5807a22ff3d138d593fd856244e155e7",
  "short_id": "2695effb",
  "created_at": "2017-07-26 09:08:53+00:00",
  "parent_ids": [
    "2a4b78934375d7f53875269ffd4f45fd83a84ebe"
  ],
  "title": "Initial commit",
  "message": "Initial commit",
  "author_name": "John Smith",
  "author_email": "john@example.com",
  "authored_date": "2012-05-28 11:42:42+00:00",
  "committer_name": "Jack Smith"
}